Id,Title fr,Title en,Author,Content fr,Content en,Year,Created at,Updated at
6,Roger Vilder,Roger Vilder,Gilles Gheerbrandt,"   Dire que les pièces de Vilder qui sont montrées à cette exposition sont du Mondrian en movement serait ne pas dire grand-chose. Si l'on tient absolument à évoquer Mondrian, on peut le faire judicieusement comme Tommaso Trini qui écrivait voici deux ans : si Mondrian est abstraction géométrique à partir d'un arbre, Vilder est restitution optique des pulsations vitales de ce même arbre. De toute manière, ce serait une erreur que de ne pas savoir dépasser la géométrie des lignes verticales et horizontales dans notre questionnement de l'œuvre.
   La géométrie n'est la que comme métaphore et Vilder souligne que CHAQUE MACHINE EST UNE TENTATIVE EN VUE DE SAISIR LES SECRETS DE LA VIE. Pierre Restany parle avec raison de L'INCESSANT CROISEMENT DES LIGNES PERPENDICULAIRES : c'est que les pièces de Vilder respirent, bougent de façon lente, uniforme et sans à-coup.
   Alors que dans les pièces à engrenages de 1966 le cycle était très court puisqu' il ne durait que le temps d'une révolution du disque Gestalt élémentaire, il est devenu plus long dans les pièces à expansion et contraction de formes élastiques et plus long encore dans les nouvelles pièces réalisées depuis 1970 et dont certaines devraient fonctionner vingt-quatre heures sur vingt-quatre pendant plus de quatre ans pour voir une configuration donnée se retrouver identique à elle-même. La mise en scène des verticales et des horizontales par Vilder nous propose des mouvements continus au long desquels il ne saurait exister de moment privilégié. 
   Le mouvement remet en cause tous les états instantanés du système. Il n y a pas d'instant particulier où la dissection de la surface opérée par les lignes orthogonales offrirait des proportions plus harmonieuses ou plus intéressantes. Plutôt dans une étape ou un état nécessairement fugitif de la configuration, c'est dans le système que nous devons voir la source d'une harmonie prolongée qui lie ce qui est à ce qui vient juste d'être et à ce qui sera.
   Il était bien naturel que Vilder soit attiré par l'usage du cinéma et de sa temporalité. Dès 1970 il concevait un film pour lequel des essais furent effectués en 1971 en vidéo sur la console graphique d'un ordinateur, et dont le scénario fut mis au point en 1972. C'est un projet très ambitieux et qui sera sans doute extrêmement difficile à réaliser mais qui traite de questions qui sont au cœur de la problématique de Vilder, comme le mouvement , le cycle et la relation entre l'unité et le tout. Un carré formé par des points s'amollit en une amibe puis on ne voit plus que l'un des points qui devient oiseau, puis nuage d'oiseaux, puis troupeau de moutons vu du ciel, puis banc de poissons, puis poisson seul dont une écaille vient en gros plan, devient un point et retrouve les points du carré de départ. 
   Ce projet fait appel à des séquences de transformation qui doivent être réalisées en animation à l'ordinateur et soulèvent d'importants problèmes techniques.
De façon plus générale Vilder a réalisé un certain nombre de films ou vidéogrammes d'animation cybernétique et l'ordinateur lui a permis de créer des œuvres qui auraient été souvent impossibles de réaliser par des moyens mécaniques. Ainsi le film qui est présenté pendant l'exposition, montre un carré divisé en un certain nombre de rectangles de couleur dont les surfaces varient de façon continue. Ce film a été conçu en 1971, préparé en 1972, filmé une première fois en 1973, tourné à nouveau en 1974 et finalement montré en 1975.Les péripéties de sa réalisation font comprendre ce qu'il faut d'énergie et de force de conviction pour réussir à produire un tel film en dehors du circuit normal. 
   L'œuvre de Vilder depuis dix ans a toujours su viser juste. Les différentes séries de pièces étaient fascinantes et très fortes quand elles sont apparues, et les plus anciennes comme les plus récentes gardent intacte cette force de conviction que tant d'œuvres cinétiques n'ont jamais eu, ou ont vite perdu par légèreté ou tendance à verser dans le gadget décoratif. Vilder est un classique et ses œuvres sont non pas de simples objets à voir mais des objets de connaissance et des outils de méditation avec lesquels on voudrait vivre.","   To say that the works of Vilder shown in this exhibition are Mondrians set in motion would neither Go very far, nor would mean very much. However, if one insists upon evoquing Mondrian in the context of Vilders work, one can do it judiciously, as Tommaso Trini who wrote two years ago: MONDRIAN STARTS FROM A TREE TO BUILD A GEOMETRICAL ABSTRACTION, WHEREAS VILDER DEALS WITH THE OPTICAL RENDERING OF THE VITAL PULSATIONS OF THE SAME TREE. It would certainly be a mistake not to go beyond the geometry of vertical and horizontal lines in our interrogation of the work. Geometry is present only as a metaphor, and Vilder points out that EACH WORK IS AN ATTEMPT TO GRAP THE SECRETS OF LIFE. 
   Pierre Restany is right to speak of the RELENTLESS CROSSING OF THE PERPENDICULAR LINES: indeed the pieces of Vilder breathe and move in a slow, smooth and unform way. Whereas the cycle of the 1966 gear pieces was short, lasting through a single revolution of the elementary Gestalt wheel, it became longer in the expanding and contracting pieces that followed and longer still in the new works since 1970. Some of these would have to be in continuous operation for more than four years, twenty-four hours a day, for us to see them repeat a given configuration. 
   The scenario of verticals and horizontals that Vilder has organized offers us continuous movements along which there is no place for prime moments. The movements questions all the instantaneous states of the system. There is no particular instant where the orthogonal lines would offer proportions in the division of the surface that would be more harmonious or more interesting. Rather than in a particular stage, or a necessarily fugitive state of the configuration, it is in the system itself that we have to look for the source of q continued harmony that ties what is with what has just been and with what will be. 
   It was quite natural for Vilder to be attracted by the use of cinema and its temporality. As early as 1970, he conceived a film for which trial runs were made in video from the graphic screen of a computer in 1971, and the scenario of which was completed in 1972. It is an ambitious project, which no doubt will be extremely difficult to carry through. 
   But it deals with questions which are the heart of Vilders problematic, such as movement, cycle or the relation of the unit to the whole. A square made up of dots softens into an amoebic shape, only one dot remains visible and evolves into a bird, a cloud or birds, a flock of fish seen from the sky, a school of fish, one fish, a single scale which in turns becomes a dot that brings us back to the dots of the original square. This project calls for sophisticated transformation sequences which have to be carried out with the help of computer animation and there are important technical problems to be solved. 
   In addition Vilder has produced several short animated films and videotapes and the computer allowed him to create works that most often would have been impossible to achieve with conventional mechanical means. For example, the film which is shown during this exhibition depicts a square divided into a certain number of coloured rectangular areas the surfaces of which vary continuously. The film was conceived in 1971, prepared in 1972, shot a first time in 1973, re-shot in 1974 and finally edited in 1975. The difficulties of this completion demonstrate the energy and power of conviction needed to succeed in producing such a film outside the normal channels. Vilders work of the last ten years always remained of excellent quality. 
   The successive series of works were all fascinating and very powerful when they appeared and the older ones as well as the latest keep intact this power of conviction that so many kinetic works never had or promptly lost by being light or decorative gadgets. Vilder is a classic and his pieces work not as simple objects to view, but as objects of knowledge and tools for meditation with which one would want to live.
",1975,2020-01-16 14:10:16 UTC,2020-01-16 14:10:16 UTC
5,ROGER VILDER : LA GEOMETRIE DE L'INSTINCT VITAL,ROGER VILDER : THE GEOMETRY OF THE VITAL INSTINCT,Pierre Restany,"   A partir d'une morphologie et d'une syntaxe constructiviste classiques, la vision de Roger Vilder se développe sans complexes et sans contraintes au gré d'une sensualité toute orientale. Le cinétisme de Vilder est loin d'être une fin en soi. C'est à travers les termes temporaires (et temporalisés) du langage géométrique qu'il a entrepris de crier son amour de la vie et de nous le communiquer. « Je suis un dieu sans pouvoirs car je n'accepte pas mes propres faiblesses », nous confie-t-il dans un texte écrit à Montréal en février 1970. Cet aveu est tout un programme. 
   Ce fils du soleil et de la Méditerranée est allé vivre l'expérience du Grand Nord et de ses immenses espaces. Sans exagérer le côté sentimental de toute référence biographique, il y a autre chose que du simple hasard dans cette migration personnelle à travers l'espace-temps de la géographie et de l'histoire. Si Vilder a recours à la forme géométrique, c'est qu'il entend aller au fond des choses, exprimer l'essentiel de la vie à travers sa constante métamorphose. Ses reliefs animés qui figurent l'incessant croisement de deux lignes perpendiculaires expriment à la fois un Mondrian et tous les Mondrian du monde. La vie, c'est la quadrature du cercle et Vilder sait bien que le computer design a résolu le problème. Sur le plan formel, et uniquement sur celui-ci bien sûr, car le secret de la vie, qui est aussi celui de toutes les baguettes magiques, est éternel retour, éternel départ, éternel recommencement ab ovo. 
   Et cet éternel recommencement de la vie n'est pas un miracle mais une raison de vivre. Dans un scénario de film récent (octobre 1972), Roger Vilder imagine de nous décrire l'amplitude extrême d'une métamorphose élémentaire.Un carré parfait, assemblage de points, devient oiseau, vol d'oiseaux, nuage en formation serrée, poisson, banc de poissons, pour retourner enfin au carré initial. L'esprit de géométrie s'identifie ici à l'instinct profond qui appréhende les manifestations élémentaires de l'existence. 

   Ma rencontre avec Vilder a été simple, rapide et définitive. Je crois à la simplicité tenace de ce sorcier sans miracles, à son amour fou de la vie, à son réalisme mystique, à tout ce qu'il porte en lui d'instinct et qu'il exprime spontanément : ces gens là sont rares, qui ne s'embarrassent en aucune façon des contingences formelles du déjà fait ou du déjà vu, et qui s'obstinent à jeter un regard toujours neuf sur le monde.","   Departing from the classical constructivist’s morphology and syntax, Roger Vilder’s vision has developed without complex nor contraints to the liking of an all oriental sensuality. It is through the temporary terms of the geometrical langage that he undertakes to shout out his love of life and communicating this to us. « I am a powerless god because I do not accept my own weaknesses » he tells us in a text written in Montreal in February 1970. 
   This recognition is a whole program in itself. This « son of the mediterranean sea and sun » has gone to live the great northern experience and the wide open spaces. Without emphasizing the sentimental side of all biographical reference, there is something else than a simple hazard to his personal migration though time and space in geography and history. 
   If Vilder resorts to geometric forms, it is because he intends to reach depths, to express the essence of life through its constant metamorphosis. His animated reliefs showing the relentless crossing of two perpendicular lines expresses one Mondrian and all the Mondrian of the world. Life is the squaring of the circle and Vilder knows well that computer design has solved the problem. On the formal plan, and uniquely on this one of course, because the secret of life, which is also that of the magical wand, is the eternal comeback, eternal beginning, eternal starting over ‘ab ovo’. 
   This eternal starting over of life is not a miracle but a reason to live. In a recent film scenario (October 1972) Roger Vilder describes the extreme amplitude of an elementary metamorphosis. A cluster of dots inscribed in a perfect square, becomes birds flying in an amboid cloud shape, which becomes a school of fish swimming, becoming a herd of sheep running around, seen from above, which turns back to the initial dots within the square. Here, the spirit of geometry identifies itself with a deep instinct apprehending primary elements of existence. 

   My meeting with Roger Vilder was quick, simple, decisive. I believe in the simple tenacity of this sorcerer without miracles, at his crazy love of life, at his mystical realism and all that he bears within him of instinct that he expresses spontaneously : the kind of people are rare, they do not bother themselves with formal contingencies of the already seen or done and obstinately look at the world with constantly renewed eyes.",1973,2020-01-16 14:07:36 UTC,2020-01-16 14:07:36 UTC
